{
  "formatVersion": 1,
  "source": {
    "bundle": [
      "../structures/skeleton/order.xsd"
    ],
    "fingerprint": "sha256:df1714b8b2e4b09e326626a2ea72780bf6298a0ca733c69f5586ea657e4bd90d",
    "root": {
      "element": "Q{urn:flottila:corpus:skeleton}Order"
    }
  },
  "target": {
    "bundle": [
      "../structures/skeleton/order.xsd"
    ],
    "fingerprint": "sha256:df1714b8b2e4b09e326626a2ea72780bf6298a0ca733c69f5586ea657e4bd90d",
    "root": {
      "element": "Q{urn:flottila:corpus:skeleton}Order"
    }
  },
  "targetFieldMappings": {
    "/Q{urn:flottila:corpus:skeleton}Order/OrderId": {
      "boxes": {
        "a1": {
          "field": "/Q{urn:flottila:corpus:skeleton}Order/OrderId",
          "kind": "source"
        }
      },
      "id": "t1",
      "result": "a1"
    }
  }
}
